/data/miniforge3/envs/llama_sae_env/lib/python3.11/site-packages/transformers/utils/hub.py:111: FutureWarning: Using `TRANSFORMERS_CACHE` is deprecated and will be removed in v5 of Transformers. Use `HF_HOME` instead.
  warnings.warn(

================================================================================
REWARD CHOICE EXPERIMENT - ALL FEATURES
================================================================================
================================================================================
Loading Models for Reward Choice - ALL Features
================================================================================
Loading Llama-3.1-8B-Base model...
Loading checkpoint shards:   0%|          | 0/4 [00:00<?, ?it/s]Loading checkpoint shards:  25%|██▌       | 1/4 [00:01<00:04,  1.43s/it]Loading checkpoint shards:  50%|█████     | 2/4 [00:02<00:02,  1.24s/it]Loading checkpoint shards:  75%|███████▌  | 3/4 [00:03<00:01,  1.21s/it]Loading checkpoint shards: 100%|██████████| 4/4 [00:04<00:00,  1.16it/s]Loading checkpoint shards: 100%|██████████| 4/4 [00:04<00:00,  1.01s/it]

Loading SAEs...
✅ Loading WORKING SAE for Layer 25
   Config: /data/.cache/huggingface/hub/models--fnlp--Llama3_1-8B-Base-LXR-8x/snapshots/8dbc1d85edfced43081c03c38b05514dbab1368b/Llama3_1-8B-Base-L25R-8x/hyperparams.json
   Dataset norm: 31.625
   Norm factor: 2.023715
   Using ReLU instead of JumpReLU (threshold=0.0)
   Checkpoint: /data/.cache/huggingface/hub/models--fnlp--Llama3_1-8B-Base-LXR-8x/snapshots/8dbc1d85edfced43081c03c38b05514dbab1368b/Llama3_1-8B-Base-L25R-8x/checkpoints/final_fixed.pth
✅ Working SAE loaded successfully!
   Expected reconstruction error: ~47%
   Feature clamping: VERIFIED WORKING
✅ Layer 25 SAE loaded
✅ Loading WORKING SAE for Layer 30
   Config: /data/.cache/huggingface/hub/models--fnlp--Llama3_1-8B-Base-LXR-8x/snapshots/8dbc1d85edfced43081c03c38b05514dbab1368b/Llama3_1-8B-Base-L30R-8x/hyperparams.json
   Dataset norm: 53.25
   Norm factor: 1.201878
   Using ReLU instead of JumpReLU (threshold=0.0)
   Checkpoint: /data/.cache/huggingface/hub/models--fnlp--Llama3_1-8B-Base-LXR-8x/snapshots/8dbc1d85edfced43081c03c38b05514dbab1368b/Llama3_1-8B-Base-L30R-8x/checkpoints/final_fixed.pth
✅ Working SAE loaded successfully!
   Expected reconstruction error: ~47%
   Feature clamping: VERIFIED WORKING
✅ Layer 30 SAE loaded

Loading ALL features from: /data/llm_addiction/results/llama_feature_arrays_20250813_152135.npz
✅ Layer 25: 192 features loaded
✅ Layer 30: 200 features loaded

🎯 Testing 392 total features
Total experiments: 500
Running experiments:   0%|          | 0/500 [00:00<?, ?it/s]Running experiments:   0%|          | 1/500 [00:03<31:59,  3.85s/it]Running experiments:   0%|          | 2/500 [00:04<13:59,  1.69s/it]Running experiments:   1%|          | 3/500 [00:04<08:08,  1.02it/s]Running experiments:   1%|          | 4/500 [00:04<06:16,  1.32it/s]Running experiments:   1%|          | 5/500 [00:04<05:11,  1.59it/s]Running experiments:   1%|          | 6/500 [00:05<03:49,  2.16it/s]Running experiments:   1%|▁         | 7/500 [00:05<03:41,  2.22it/s]Running experiments:   2%|▁         | 8/500 [00:08<09:39,  1.18s/it]Running experiments:   2%|▁         | 9/500 [00:08<07:02,  1.16it/s]Running experiments:   2%|▁         | 10/500 [00:08<05:53,  1.39it/s]Running experiments:   2%|▁         | 11/500 [00:09<05:07,  1.59it/s]Running experiments:   2%|▁         | 12/500 [00:09<04:03,  2.01it/s]Running experiments:   3%|▎         | 13/500 [00:09<03:12,  2.53it/s]Running experiments:   3%|▎         | 14/500 [00:09<03:04,  2.64it/s]Running experiments:   3%|▎         | 15/500 [00:12<08:18,  1.03s/it]Running experiments:   3%|▎         | 16/500 [00:12<06:52,  1.17it/s]Running experiments:   4%|▎         | 18/500 [00:13<04:34,  1.76it/s]Running experiments:   4%|▁         | 19/500 [00:13<04:15,  1.88it/s]Running experiments:   4%|▁         | 20/500 [00:14<04:01,  1.99it/s]Running experiments:   4%|▁         | 21/500 [00:14<03:14,  2.46it/s]Running experiments:   4%|▁         | 22/500 [00:14<02:34,  3.10it/s]Running experiments:   5%|▁         | 23/500 [00:17<07:29,  1.06it/s]Running experiments:   5%|▌         | 25/500 [00:17<04:20,  1.82it/s]Running experiments:   5%|▌         | 26/500 [00:17<03:39,  2.16it/s]Running experiments:   5%|▌         | 27/500 [00:17<03:37,  2.18it/s]Running experiments:   6%|▌         | 28/500 [00:18<03:39,  2.15it/s]Running experiments:   6%|▌         | 29/500 [00:18<03:35,  2.18it/s]Running experiments:   6%|▌         | 30/500 [00:21<08:09,  1.04s/it]Running experiments:   6%|▌         | 31/500 [00:21<06:46,  1.15it/s]Running experiments:   6%|▋         | 32/500 [00:22<05:43,  1.36it/s]Running experiments:   7%|▋         | 33/500 [00:22<05:02,  1.54it/s]Running experiments:   7%|▋         | 34/500 [00:23<04:48,  1.62it/s]Running experiments:   7%|▋         | 35/500 [00:25<09:25,  1.22s/it]Running experiments:   7%|▋         | 37/500 [00:26<06:00,  1.28it/s]Running experiments:   8%|▊         | 38/500 [00:26<05:17,  1.45it/s]Running experiments:   8%|▊         | 39/500 [00:26<04:11,  1.83it/s]Running experiments:   8%|▊         | 40/500 [00:26<03:20,  2.30it/s]Running experiments:   8%|▊         | 41/500 [00:27<03:20,  2.28it/s]Running experiments:   8%|▊         | 42/500 [00:27<03:17,  2.32it/s]Running experiments:   9%|▊         | 43/500 [00:30<07:39,  1.01s/it]Running experiments:   9%|▉         | 44/500 [00:30<06:19,  1.20it/s]Running experiments:   9%|▉         | 45/500 [00:31<05:25,  1.40it/s]Running experiments:   9%|▉         | 46/500 [00:31<04:47,  1.58it/s]Running experiments:   9%|▉         | 47/500 [00:31<04:20,  1.74it/s]Running experiments:  10%|▉         | 48/500 [00:32<04:05,  1.84it/s]Running experiments:  10%|▉         | 49/500 [00:34<08:22,  1.11s/it]Running experiments:  10%|█         | 50/500 [00:35<06:50,  1.10it/s]Running experiments:  10%|█         | 51/500 [00:35<05:41,  1.31it/s]Running experiments:  10%|█         | 52/500 [00:36<04:55,  1.52it/s]Running experiments:  11%|█         | 53/500 [00:36<04:25,  1.69it/s]Running experiments:  11%|█         | 54/500 [00:36<03:25,  2.17it/s]Running experiments:  11%|█         | 55/500 [00:39<07:44,  1.04s/it]Running experiments:  11%|█         | 56/500 [00:39<06:42,  1.10it/s]Running experiments:  11%|█▁        | 57/500 [00:40<05:39,  1.31it/s]Running experiments:  12%|█▁        | 58/500 [00:40<04:52,  1.51it/s]Running experiments:  12%|█▁        | 59/500 [00:40<03:49,  1.92it/s]Running experiments:  12%|█▁        | 60/500 [00:41<03:39,  2.00it/s]Running experiments:  12%|█▁        | 61/500 [00:43<07:22,  1.01s/it]Running experiments:  12%|█▁        | 62/500 [00:43<06:05,  1.20it/s]Running experiments:  13%|█▎        | 63/500 [00:43<04:34,  1.59it/s]Running experiments:  13%|█▎        | 64/500 [00:44<04:07,  1.76it/s]Running experiments:  13%|█▎        | 65/500 [00:44<03:54,  1.85it/s]Running experiments:  13%|█▎        | 66/500 [00:44<03:03,  2.37it/s]Running experiments:  13%|█▎        | 67/500 [00:45<03:02,  2.37it/s]Running experiments:  14%|█▎        | 68/500 [00:47<07:14,  1.01s/it]Running experiments:  14%|█▁        | 69/500 [00:48<05:58,  1.20it/s]Running experiments:  14%|█▁        | 70/500 [00:48<05:06,  1.40it/s]Running experiments:  14%|█▁        | 71/500 [00:49<04:28,  1.60it/s]Running experiments:  14%|█▁        | 72/500 [00:49<04:03,  1.76it/s]Running experiments:  15%|█▁        | 73/500 [00:49<03:49,  1.86it/s]Running experiments:  15%|█▁        | 74/500 [00:52<08:50,  1.24s/it]Running experiments:  15%|█▌        | 75/500 [00:53<07:05,  1.00s/it]Running experiments:  15%|█▌        | 76/500 [00:53<05:51,  1.21it/s]Running experiments:  15%|█▌        | 77/500 [00:54<05:00,  1.41it/s]Running experiments:  16%|█▌        | 78/500 [00:54<04:25,  1.59it/s]Running experiments:  16%|█▌        | 79/500 [00:57<08:29,  1.21s/it]Running experiments:  16%|█▌        | 80/500 [00:57<06:49,  1.02it/s]Running experiments:  16%|█▌        | 81/500 [00:58<05:39,  1.23it/s]Running experiments:  16%|█▋        | 82/500 [00:58<04:50,  1.44it/s]Running experiments:  17%|█▋        | 83/500 [00:58<04:15,  1.63it/s]Running experiments:  17%|█▋        | 84/500 [01:01<08:12,  1.18s/it]Running experiments:  17%|█▋        | 85/500 [01:01<06:39,  1.04it/s]Running experiments:  17%|█▋        | 86/500 [01:02<05:31,  1.25it/s]Running experiments:  17%|█▋        | 87/500 [01:02<04:44,  1.45it/s]Running experiments:  18%|█▊        | 88/500 [01:03<04:11,  1.64it/s]Running experiments:  18%|█▊        | 89/500 [01:03<03:18,  2.07it/s]Running experiments:  18%|█▊        | 90/500 [01:06<07:54,  1.16s/it]Running experiments:  18%|█▊        | 91/500 [01:06<06:00,  1.14it/s]Running experiments:  18%|█▊        | 92/500 [01:06<05:04,  1.34it/s]Running experiments:  19%|█▊        | 93/500 [01:07<04:23,  1.55it/s]Running experiments:  19%|█▉        | 94/500 [01:07<04:08,  1.64it/s]Running experiments:  19%|█▉        | 95/500 [01:07<03:19,  2.03it/s]Running experiments:  19%|█▉        | 96/500 [01:10<07:32,  1.12s/it]Running experiments:  19%|█▉        | 97/500 [01:10<06:09,  1.09it/s]Running experiments:  20%|█▉        | 98/500 [01:11<05:07,  1.31it/s]Running experiments:  20%|█▉        | 99/500 [01:11<04:26,  1.51it/s]Running experiments:  20%|██        | 100/500 [01:12<03:57,  1.69it/s]Running experiments:  20%|██        | 101/500 [01:12<03:36,  1.84it/s]Running experiments:  20%|██        | 102/500 [01:14<06:50,  1.03s/it]Running experiments:  21%|██        | 103/500 [01:15<05:39,  1.17it/s]Running experiments:  21%|██        | 104/500 [01:15<04:23,  1.50it/s]Running experiments:  21%|██        | 105/500 [01:15<03:39,  1.80it/s]Running experiments:  21%|██        | 106/500 [01:16<03:33,  1.85it/s]Running experiments:  21%|██▁       | 107/500 [01:16<03:21,  1.95it/s]Running experiments:  22%|██▁       | 108/500 [01:19<07:32,  1.15s/it]Running experiments:  22%|██▁       | 109/500 [01:19<06:25,  1.02it/s]Running experiments:  22%|██▁       | 110/500 [01:20<04:55,  1.32it/s]Running experiments:  22%|██▁       | 111/500 [01:20<03:43,  1.74it/s]Running experiments:  22%|██▁       | 112/500 [01:20<03:26,  1.88it/s]Running experiments:  23%|██▎       | 113/500 [01:21<03:13,  2.00it/s]Running experiments:  23%|██▎       | 114/500 [01:21<02:32,  2.54it/s]Running experiments:  23%|██▎       | 115/500 [01:22<03:41,  1.74it/s]Running experiments:  23%|██▎       | 116/500 [01:24<06:25,  1.01s/it]Running experiments:  23%|██▎       | 117/500 [01:24<05:19,  1.20it/s]Running experiments:  24%|██▎       | 118/500 [01:24<04:00,  1.59it/s]Running experiments:  24%|██▁       | 119/500 [01:25<03:04,  2.07it/s]Running experiments:  24%|██▁       | 120/500 [01:25<02:25,  2.61it/s]Running experiments:  24%|██▁       | 121/500 [01:25<02:29,  2.54it/s]Running experiments:  24%|██▁       | 122/500 [01:25<02:00,  3.13it/s]Running experiments:  25%|██▁       | 123/500 [01:28<06:19,  1.01s/it]Running experiments:  25%|██▁       | 124/500 [01:28<04:51,  1.29it/s]Running experiments:  25%|██▌       | 125/500 [01:28<04:11,  1.49it/s]Running experiments:  25%|██▌       | 126/500 [01:29<03:43,  1.67it/s]Running experiments:  25%|██▌       | 127/500 [01:29<03:23,  1.83it/s]Running experiments:  26%|██▌       | 128/500 [01:30<03:09,  1.96it/s]Running experiments:  26%|██▌       | 129/500 [01:32<06:00,  1.03it/s]Running experiments:  26%|██▌       | 130/500 [01:33<05:33,  1.11it/s]Running experiments:  26%|██▌       | 131/500 [01:33<04:46,  1.29it/s]Running experiments:  26%|██▋       | 132/500 [01:34<04:13,  1.45it/s]Running experiments:  27%|██▋       | 133/500 [01:34<03:45,  1.63it/s]Running experiments:  27%|██▋       | 134/500 [01:34<03:24,  1.79it/s]Running experiments:  27%|██▋       | 135/500 [01:37<06:33,  1.08s/it]Running experiments:  27%|██▋       | 136/500 [01:37<05:28,  1.11it/s]Running experiments:  27%|██▋       | 137/500 [01:38<04:35,  1.32it/s]Running experiments:  28%|██▊       | 138/500 [01:38<03:58,  1.52it/s]Running experiments:  28%|██▊       | 139/500 [01:38<03:33,  1.69it/s]Running experiments:  28%|██▊       | 140/500 [01:39<03:16,  1.84it/s]Running experiments:  28%|██▊       | 141/500 [01:41<06:56,  1.16s/it]Running experiments:  28%|██▊       | 142/500 [01:42<05:07,  1.17it/s]Running experiments:  29%|██▊       | 143/500 [01:42<04:19,  1.37it/s]Running experiments:  29%|██▉       | 144/500 [01:43<03:52,  1.53it/s]Running experiments:  29%|██▉       | 145/500 [01:43<03:17,  1.79it/s]Running experiments:  29%|██▉       | 146/500 [01:43<03:08,  1.88it/s]Running experiments:  29%|██▉       | 147/500 [01:46<06:44,  1.15s/it]Running experiments:  30%|██▉       | 148/500 [01:46<05:26,  1.08it/s]Running experiments:  30%|██▉       | 149/500 [01:47<04:03,  1.44it/s]Running experiments:  30%|███       | 150/500 [01:47<03:43,  1.57it/s]Running experiments:  30%|███       | 151/500 [01:47<03:19,  1.75it/s]Running experiments:  30%|███       | 152/500 [01:50<07:05,  1.22s/it]Running experiments:  31%|███       | 153/500 [01:50<05:21,  1.08it/s]Running experiments:  31%|███       | 154/500 [01:51<04:29,  1.29it/s]Running experiments:  31%|███       | 155/500 [01:51<03:23,  1.70it/s]Running experiments:  31%|███       | 156/500 [01:51<03:06,  1.84it/s]Running experiments:  31%|███▁      | 157/500 [01:52<02:55,  1.95it/s]Running experiments:  32%|███▁      | 158/500 [01:52<02:52,  1.98it/s]Running experiments:  32%|███▁      | 159/500 [01:55<05:57,  1.05s/it]Running experiments:  32%|███▁      | 160/500 [01:55<04:35,  1.24it/s]Running experiments:  32%|███▁      | 161/500 [01:55<03:32,  1.60it/s]Running experiments:  32%|███▁      | 162/500 [01:56<03:12,  1.76it/s]Running experiments:  33%|███▎      | 163/500 [01:56<02:57,  1.89it/s]Running experiments:  33%|███▎      | 164/500 [01:56<02:47,  2.01it/s]Running experiments:  33%|███▎      | 165/500 [01:57<02:42,  2.06it/s]Running experiments:  33%|███▎      | 166/500 [01:59<06:01,  1.08s/it]Running experiments:  33%|███▎      | 167/500 [02:00<04:58,  1.12it/s]Running experiments:  34%|███▎      | 168/500 [02:00<03:44,  1.48it/s]Running experiments:  34%|███▁      | 169/500 [02:00<02:51,  1.92it/s]Running experiments:  34%|███▁      | 170/500 [02:00<02:27,  2.24it/s]Running experiments:  34%|███▁      | 171/500 [02:01<02:25,  2.26it/s]Running experiments:  34%|███▁      | 172/500 [02:01<02:00,  2.73it/s]Running experiments:  35%|███▁      | 173/500 [02:03<05:15,  1.04it/s]Running experiments:  35%|███▁      | 174/500 [02:04<04:27,  1.22it/s]Running experiments:  35%|███▌      | 175/500 [02:04<03:47,  1.43it/s]Running experiments:  35%|███▌      | 176/500 [02:05<03:20,  1.62it/s]Running experiments:  35%|███▌      | 177/500 [02:05<03:00,  1.79it/s]Running experiments:  36%|███▌      | 178/500 [02:06<02:51,  1.87it/s]Running experiments:  36%|███▌      | 179/500 [02:08<05:58,  1.12s/it]Running experiments:  36%|███▌      | 180/500 [02:09<04:50,  1.10it/s]Running experiments:  36%|███▌      | 181/500 [02:09<04:03,  1.31it/s]Running experiments:  36%|███▋      | 182/500 [02:09<03:03,  1.73it/s]Running experiments:  37%|███▋      | 183/500 [02:09<02:48,  1.88it/s]Running experiments:  37%|███▋      | 184/500 [02:10<02:37,  2.01it/s]Running experiments:  37%|███▋      | 185/500 [02:12<05:52,  1.12s/it]Running experiments:  37%|███▋      | 186/500 [02:13<04:48,  1.09it/s]Running experiments:  37%|███▋      | 187/500 [02:13<04:01,  1.30it/s]Running experiments:  38%|███▊      | 188/500 [02:14<03:13,  1.62it/s]Running experiments:  38%|███▊      | 189/500 [02:14<02:55,  1.77it/s]Running experiments:  38%|███▊      | 190/500 [02:15<02:42,  1.91it/s]Running experiments:  38%|███▊      | 191/500 [02:17<05:41,  1.10s/it]Running experiments:  38%|███▊      | 192/500 [02:17<04:36,  1.11it/s]Running experiments:  39%|███▊      | 193/500 [02:18<03:26,  1.49it/s]Running experiments:  39%|███▉      | 194/500 [02:18<02:44,  1.86it/s]Running experiments:  39%|███▉      | 195/500 [02:18<02:27,  2.07it/s]Running experiments:  39%|███▉      | 196/500 [02:19<02:31,  2.00it/s]Running experiments:  39%|███▉      | 197/500 [02:19<02:32,  1.99it/s]Running experiments:  40%|███▉      | 198/500 [02:22<05:24,  1.08s/it]Running experiments:  40%|███▉      | 199/500 [02:22<03:59,  1.26it/s]Running experiments:  40%|████      | 200/500 [02:22<03:06,  1.60it/s]Running experiments:  40%|████      | 201/500 [02:22<02:41,  1.86it/s]Running experiments:  40%|████      | 202/500 [02:23<02:29,  1.99it/s]Running experiments:  41%|████      | 203/500 [02:23<02:21,  2.11it/s]Running experiments:  41%|████      | 204/500 [02:26<05:28,  1.11s/it]Running experiments:  41%|████      | 205/500 [02:26<04:12,  1.17it/s]Running experiments:  41%|████      | 206/500 [02:26<03:35,  1.37it/s]Running experiments:  41%|████▁     | 207/500 [02:27<03:06,  1.57it/s]Running experiments:  42%|████▁     | 208/500 [02:27<02:27,  1.98it/s]Running experiments:  42%|████▁     | 209/500 [02:27<02:20,  2.07it/s]Running experiments:  42%|████▁     | 210/500 [02:28<02:20,  2.06it/s]Running experiments:  42%|████▁     | 211/500 [02:31<05:29,  1.14s/it]Running experiments:  42%|████▁     | 212/500 [02:31<04:25,  1.08it/s]Running experiments:  43%|████▎     | 213/500 [02:31<03:41,  1.29it/s]Running experiments:  43%|████▎     | 214/500 [02:32<03:13,  1.48it/s]Running experiments:  43%|████▎     | 215/500 [02:32<02:51,  1.66it/s]Running experiments:  43%|████▎     | 216/500 [02:35<05:29,  1.16s/it]Running experiments:  43%|████▎     | 217/500 [02:35<04:28,  1.05it/s]Running experiments:  44%|████▎     | 218/500 [02:36<03:43,  1.26it/s]Running experiments:  44%|████▁     | 219/500 [02:36<03:13,  1.46it/s]Running experiments:  44%|████▁     | 220/500 [02:37<02:50,  1.64it/s]Running experiments:  44%|████▁     | 221/500 [02:37<02:40,  1.74it/s]Running experiments:  44%|████▁     | 222/500 [02:40<05:47,  1.25s/it]Running experiments:  45%|████▁     | 223/500 [02:40<04:37,  1.00s/it]Running experiments:  45%|████▁     | 224/500 [02:41<03:49,  1.20it/s]Running experiments:  45%|████▌     | 225/500 [02:41<03:16,  1.40it/s]Running experiments:  45%|████▌     | 226/500 [02:44<05:44,  1.26s/it]Running experiments:  45%|████▌     | 227/500 [02:44<04:35,  1.01s/it]Running experiments:  46%|████▌     | 228/500 [02:45<03:46,  1.20it/s]Running experiments:  46%|████▌     | 229/500 [02:45<03:14,  1.39it/s]Running experiments:  46%|████▌     | 230/500 [02:45<02:33,  1.76it/s]Running experiments:  46%|████▌     | 231/500 [02:45<02:00,  2.23it/s]Running experiments:  46%|████▋     | 232/500 [02:46<01:58,  2.26it/s]Running experiments:  47%|████▋     | 233/500 [02:48<04:42,  1.06s/it]Running experiments:  47%|████▋     | 234/500 [02:49<03:51,  1.15it/s]Running experiments:  47%|████▋     | 235/500 [02:49<02:56,  1.51it/s]Running experiments:  47%|████▋     | 236/500 [02:49<02:14,  1.96it/s]Running experiments:  47%|████▋     | 237/500 [02:49<02:06,  2.07it/s]Running experiments:  48%|████▊     | 238/500 [02:50<02:02,  2.13it/s]Running experiments:  48%|████▊     | 239/500 [02:50<01:37,  2.69it/s]Running experiments:  48%|████▊     | 240/500 [02:53<04:40,  1.08s/it]Running experiments:  48%|████▊     | 241/500 [02:53<03:59,  1.08it/s]Running experiments:  48%|████▊     | 242/500 [02:54<03:20,  1.29it/s]Running experiments:  49%|████▊     | 243/500 [02:54<02:53,  1.48it/s]Running experiments:  49%|████▉     | 244/500 [02:55<02:34,  1.66it/s]Running experiments:  49%|████▉     | 245/500 [02:55<01:58,  2.15it/s]Running experiments:  49%|████▉     | 246/500 [02:57<04:28,  1.06s/it]Running experiments:  49%|████▉     | 247/500 [02:58<03:41,  1.14it/s]Running experiments:  50%|████▉     | 248/500 [02:58<03:05,  1.36it/s]Running experiments:  50%|████▉     | 249/500 [02:58<02:26,  1.71it/s]Running experiments:  50%|█████     | 250/500 [02:59<02:14,  1.86it/s]Running experiments:  50%|█████     | 251/500 [02:59<01:45,  2.37it/s]Running experiments:  50%|█████     | 252/500 [02:59<01:23,  2.95it/s]Running experiments:  51%|█████     | 253/500 [02:59<01:09,  3.57it/s]Running experiments:  51%|█████     | 254/500 [02:59<00:56,  4.39it/s]Running experiments:  51%|█████     | 255/500 [02:59<00:47,  5.13it/s]Running experiments:  51%|█████     | 256/500 [03:02<03:32,  1.15it/s]Running experiments:  51%|█████▁    | 257/500 [03:02<02:40,  1.51it/s]Running experiments:  52%|█████▁    | 258/500 [03:02<02:02,  1.97it/s]Running experiments:  52%|█████▁    | 259/500 [03:02<01:35,  2.52it/s]Running experiments:  52%|█████▁    | 260/500 [03:02<01:17,  3.08it/s]Running experiments:  52%|█████▁    | 261/500 [03:03<01:04,  3.70it/s]Running experiments:  52%|█████▁    | 262/500 [03:03<00:58,  4.08it/s]Running experiments:  53%|█████▎    | 263/500 [03:03<00:51,  4.64it/s]Running experiments:  53%|█████▎    | 264/500 [03:03<00:50,  4.64it/s]Running experiments:  53%|█████▎    | 265/500 [03:03<00:49,  4.79it/s]Running experiments:  53%|█████▎    | 266/500 [03:04<00:44,  5.27it/s]Running experiments:  54%|█████▎    | 268/500 [03:06<02:43,  1.42it/s]Running experiments:  54%|█████▁    | 270/500 [03:06<01:47,  2.14it/s]Running experiments:  54%|█████▁    | 271/500 [03:07<01:32,  2.47it/s]Running experiments:  55%|█████▁    | 273/500 [03:07<01:05,  3.44it/s]Running experiments:  55%|█████▌    | 275/500 [03:07<00:47,  4.73it/s]Running experiments:  55%|█████▌    | 276/500 [03:07<00:53,  4.17it/s]Running experiments:  55%|█████▌    | 277/500 [03:07<00:48,  4.60it/s]Running experiments:  56%|█████▌    | 279/500 [03:08<00:41,  5.36it/s]Running experiments:  56%|█████▌    | 281/500 [03:08<00:34,  6.35it/s]Running experiments:  56%|█████▋    | 282/500 [03:08<00:46,  4.65it/s]Running experiments:  57%|█████▋    | 283/500 [03:11<02:29,  1.45it/s]Running experiments:  57%|█████▋    | 284/500 [03:11<02:05,  1.72it/s]Running experiments:  57%|█████▋    | 285/500 [03:11<01:41,  2.11it/s]Running experiments:  57%|█████▋    | 286/500 [03:12<01:43,  2.08it/s]Running experiments:  58%|█████▊    | 288/500 [03:12<01:03,  3.31it/s]Running experiments:  58%|█████▊    | 289/500 [03:12<00:56,  3.76it/s]Running experiments:  58%|█████▊    | 291/500 [03:12<00:39,  5.28it/s]Running experiments:  58%|█████▊    | 292/500 [03:12<00:39,  5.20it/s]Running experiments:  59%|█████▉    | 294/500 [03:12<00:29,  6.97it/s]Running experiments:  59%|█████▉    | 295/500 [03:12<00:29,  6.92it/s]Running experiments:  59%|█████▉    | 297/500 [03:13<00:23,  8.78it/s]Running experiments:  60%|█████▉    | 299/500 [03:15<01:47,  1.88it/s]Running experiments:  60%|██████    | 300/500 [03:15<01:36,  2.08it/s]Running experiments:  60%|██████    | 301/500 [03:16<01:36,  2.07it/s]Running experiments:  60%|██████    | 302/500 [03:16<01:34,  2.08it/s]Running experiments:  61%|██████    | 303/500 [03:17<01:32,  2.13it/s]Running experiments:  61%|██████    | 304/500 [03:17<01:14,  2.62it/s]Running experiments:  61%|██████    | 305/500 [03:17<01:02,  3.14it/s]Running experiments:  61%|██████    | 306/500 [03:20<03:08,  1.03it/s]Running experiments:  61%|██████▁   | 307/500 [03:20<02:20,  1.37it/s]Running experiments:  62%|██████▁   | 308/500 [03:20<01:49,  1.75it/s]Running experiments:  62%|██████▁   | 309/500 [03:21<01:44,  1.84it/s]Running experiments:  62%|██████▁   | 310/500 [03:21<01:37,  1.95it/s]Running experiments:  62%|██████▁   | 311/500 [03:21<01:32,  2.05it/s]Running experiments:  62%|██████▁   | 312/500 [03:22<01:27,  2.14it/s]Running experiments:  63%|██████▎   | 313/500 [03:22<01:08,  2.74it/s]Running experiments:  63%|██████▎   | 314/500 [03:25<03:13,  1.04s/it]Running experiments:  63%|██████▎   | 315/500 [03:25<02:38,  1.17it/s]Running experiments:  63%|██████▎   | 316/500 [03:25<02:13,  1.38it/s]Running experiments:  63%|██████▎   | 317/500 [03:26<01:55,  1.58it/s]Running experiments:  64%|██████▎   | 318/500 [03:26<01:44,  1.75it/s]Running experiments:  64%|██████▁   | 319/500 [03:29<03:25,  1.13s/it]Running experiments:  64%|██████▁   | 321/500 [03:29<01:59,  1.50it/s]Running experiments:  64%|██████▁   | 322/500 [03:29<01:47,  1.66it/s]Running experiments:  65%|██████▁   | 323/500 [03:30<01:41,  1.75it/s]Running experiments:  65%|██████▁   | 324/500 [03:30<01:33,  1.88it/s]Running experiments:  65%|██████▌   | 325/500 [03:31<01:27,  2.01it/s]Running experiments:  65%|██████▌   | 326/500 [03:33<03:13,  1.11s/it]Running experiments:  65%|██████▌   | 327/500 [03:34<02:37,  1.10it/s]Running experiments:  66%|██████▌   | 328/500 [03:34<02:12,  1.30it/s]Running experiments:  66%|██████▌   | 329/500 [03:34<01:37,  1.75it/s]Running experiments:  66%|██████▌   | 331/500 [03:35<01:00,  2.80it/s]Running experiments:  66%|██████▋   | 332/500 [03:35<01:03,  2.66it/s]Running experiments:  67%|██████▋   | 333/500 [03:35<01:04,  2.59it/s]Running experiments:  67%|██████▋   | 334/500 [03:38<02:43,  1.01it/s]Running experiments:  67%|██████▋   | 335/500 [03:39<02:26,  1.12it/s]Running experiments:  67%|██████▋   | 337/500 [03:39<01:39,  1.64it/s]Running experiments:  68%|██████▊   | 338/500 [03:39<01:22,  1.97it/s]Running experiments:  68%|██████▊   | 339/500 [03:40<01:19,  2.02it/s]Running experiments:  68%|██████▊   | 340/500 [03:43<02:57,  1.11s/it]Running experiments:  68%|██████▊   | 341/500 [03:43<02:27,  1.08it/s]Running experiments:  68%|██████▊   | 342/500 [03:43<02:04,  1.27it/s]Running experiments:  69%|██████▊   | 343/500 [03:44<01:46,  1.47it/s]Running experiments:  69%|██████▉   | 344/500 [03:44<01:34,  1.65it/s]Running experiments:  69%|██████▉   | 345/500 [03:45<01:25,  1.81it/s]Running experiments:  69%|██████▉   | 346/500 [03:47<02:48,  1.09s/it]Running experiments:  69%|██████▉   | 347/500 [03:48<02:18,  1.11it/s]Running experiments:  70%|██████▉   | 348/500 [03:48<01:55,  1.32it/s]Running experiments:  70%|██████▉   | 349/500 [03:48<01:32,  1.63it/s]Running experiments:  70%|███████   | 350/500 [03:49<01:23,  1.80it/s]Running experiments:  70%|███████   | 351/500 [03:49<01:17,  1.93it/s]Running experiments:  70%|███████   | 352/500 [03:52<02:47,  1.13s/it]Running experiments:  71%|███████   | 353/500 [03:52<02:05,  1.17it/s]Running experiments:  71%|███████   | 355/500 [03:52<01:25,  1.69it/s]Running experiments:  71%|███████   | 356/500 [03:53<01:19,  1.81it/s]Running experiments:  71%|███████▁  | 357/500 [03:53<01:15,  1.90it/s]Running experiments:  72%|███████▁  | 358/500 [03:54<01:11,  2.00it/s]Running experiments:  72%|███████▁  | 359/500 [03:56<02:23,  1.02s/it]Running experiments:  72%|███████▁  | 360/500 [03:57<01:59,  1.17it/s]Running experiments:  72%|███████▁  | 361/500 [03:57<01:41,  1.37it/s]Running experiments:  73%|███████▎  | 363/500 [03:57<01:10,  1.96it/s]Running experiments:  73%|███████▎  | 364/500 [03:58<01:08,  2.00it/s]Running experiments:  73%|███████▎  | 366/500 [03:58<00:43,  3.11it/s]Running experiments:  73%|███████▎  | 367/500 [04:00<01:45,  1.27it/s]Running experiments:  74%|███████▎  | 368/500 [04:01<01:32,  1.43it/s]Running experiments:  74%|███████▁  | 369/500 [04:01<01:22,  1.59it/s]Running experiments:  74%|███████▁  | 370/500 [04:01<01:04,  2.01it/s]Running experiments:  74%|███████▁  | 371/500 [04:02<01:04,  2.00it/s]Running experiments:  74%|███████▁  | 372/500 [04:02<01:02,  2.06it/s]Running experiments:  75%|███████▁  | 373/500 [04:05<02:18,  1.09s/it]Running experiments:  75%|███████▁  | 374/500 [04:05<01:53,  1.11it/s]Running experiments:  75%|███████▌  | 375/500 [04:06<01:34,  1.32it/s]Running experiments:  75%|███████▌  | 376/500 [04:06<01:21,  1.51it/s]Running experiments:  75%|███████▌  | 377/500 [04:07<01:12,  1.70it/s]Running experiments:  76%|███████▌  | 378/500 [04:07<01:11,  1.71it/s]Running experiments:  76%|███████▌  | 379/500 [04:10<02:23,  1.18s/it]Running experiments:  76%|███████▌  | 380/500 [04:10<01:58,  1.01it/s]Running experiments:  76%|███████▌  | 381/500 [04:11<01:29,  1.33it/s]Running experiments:  76%|███████▋  | 382/500 [04:11<01:07,  1.75it/s]Running experiments:  77%|███████▋  | 383/500 [04:11<00:51,  2.26it/s]Running experiments:  77%|███████▋  | 384/500 [04:11<00:52,  2.23it/s]Running experiments:  77%|███████▋  | 385/500 [04:11<00:41,  2.77it/s]Running experiments:  77%|███████▋  | 386/500 [04:12<00:43,  2.65it/s]Running experiments:  77%|███████▋  | 387/500 [04:14<01:55,  1.02s/it]Running experiments:  78%|███████▊  | 388/500 [04:15<01:35,  1.18it/s]Running experiments:  78%|███████▊  | 389/500 [04:15<01:20,  1.38it/s]Running experiments:  78%|███████▊  | 390/500 [04:16<01:09,  1.58it/s]Running experiments:  78%|███████▊  | 391/500 [04:16<01:02,  1.74it/s]Running experiments:  78%|███████▊  | 392/500 [04:17<00:58,  1.85it/s]Running experiments:  79%|███████▊  | 393/500 [04:19<02:06,  1.18s/it]Running experiments:  79%|███████▉  | 394/500 [04:20<01:41,  1.05it/s]Running experiments:  79%|███████▉  | 395/500 [04:20<01:23,  1.26it/s]Running experiments:  79%|███████▉  | 396/500 [04:21<01:10,  1.47it/s]Running experiments:  79%|███████▉  | 397/500 [04:21<01:01,  1.66it/s]Running experiments:  80%|███████▉  | 398/500 [04:21<00:48,  2.11it/s]Running experiments:  80%|███████▉  | 399/500 [04:24<01:59,  1.18s/it]Running experiments:  80%|████████  | 400/500 [04:24<01:35,  1.05it/s]Running experiments:  80%|████████  | 401/500 [04:25<01:18,  1.25it/s]Running experiments:  80%|████████  | 402/500 [04:25<01:07,  1.45it/s]Running experiments:  81%|████████  | 403/500 [04:26<01:00,  1.62it/s]Running experiments:  81%|████████  | 404/500 [04:28<01:59,  1.25s/it]Running experiments:  81%|████████  | 405/500 [04:29<01:34,  1.00it/s]Running experiments:  81%|████████  | 406/500 [04:29<01:17,  1.22it/s]Running experiments:  81%|████████▁ | 407/500 [04:30<01:05,  1.42it/s]Running experiments:  82%|████████▁ | 408/500 [04:30<00:56,  1.61it/s]Running experiments:  82%|████████▁ | 409/500 [04:32<01:43,  1.13s/it]Running experiments:  82%|████████▁ | 410/500 [04:33<01:22,  1.09it/s]Running experiments:  82%|████████▁ | 411/500 [04:33<01:08,  1.30it/s]Running experiments:  82%|████████▁ | 412/500 [04:34<00:58,  1.51it/s]Running experiments:  83%|████████▎ | 413/500 [04:34<00:51,  1.70it/s]Running experiments:  83%|████████▎ | 414/500 [04:35<00:46,  1.87it/s]Running experiments:  83%|████████▎ | 415/500 [04:37<01:34,  1.11s/it]Running experiments:  83%|████████▎ | 416/500 [04:37<01:17,  1.08it/s]Running experiments:  83%|████████▎ | 417/500 [04:38<01:04,  1.29it/s]Running experiments:  84%|████████▎ | 418/500 [04:38<00:55,  1.49it/s]Running experiments:  84%|████████▁ | 419/500 [04:38<00:42,  1.92it/s]Running experiments:  84%|████████▁ | 420/500 [04:39<00:39,  2.03it/s]Running experiments:  84%|████████▁ | 421/500 [04:41<01:25,  1.08s/it]Running experiments:  84%|████████▁ | 422/500 [04:42<01:09,  1.12it/s]Running experiments:  85%|████████▁ | 423/500 [04:42<00:57,  1.34it/s]Running experiments:  85%|████████▁ | 424/500 [04:43<00:49,  1.53it/s]Running experiments:  85%|████████▌ | 425/500 [04:43<00:43,  1.72it/s]Running experiments:  85%|████████▌ | 426/500 [04:43<00:39,  1.87it/s]Running experiments:  85%|████████▌ | 427/500 [04:46<01:20,  1.10s/it]Running experiments:  86%|████████▌ | 428/500 [04:46<01:05,  1.10it/s]Running experiments:  86%|████████▌ | 429/500 [04:47<00:54,  1.31it/s]Running experiments:  86%|████████▌ | 430/500 [04:47<00:46,  1.51it/s]Running experiments:  86%|████████▌ | 431/500 [04:48<00:40,  1.70it/s]Running experiments:  86%|████████▋ | 432/500 [04:48<00:30,  2.20it/s]Running experiments:  87%|████████▋ | 433/500 [04:50<01:13,  1.10s/it]Running experiments:  87%|████████▋ | 434/500 [04:51<00:56,  1.17it/s]Running experiments:  87%|████████▋ | 436/500 [04:51<00:37,  1.72it/s]Running experiments:  87%|████████▋ | 437/500 [04:52<00:34,  1.81it/s]Running experiments:  88%|████████▊ | 438/500 [04:52<00:33,  1.86it/s]Running experiments:  88%|████████▊ | 439/500 [04:53<00:31,  1.94it/s]Running experiments:  88%|████████▊ | 440/500 [04:55<01:05,  1.10s/it]Running experiments:  88%|████████▊ | 441/500 [04:56<00:53,  1.11it/s]Running experiments:  89%|████████▊ | 443/500 [04:56<00:34,  1.65it/s]Running experiments:  89%|████████▉ | 444/500 [04:57<00:31,  1.78it/s]Running experiments:  89%|████████▉ | 446/500 [04:57<00:23,  2.28it/s]Running experiments:  89%|████████▉ | 447/500 [04:59<00:47,  1.12it/s]Running experiments:  90%|████████▉ | 448/500 [05:00<00:41,  1.26it/s]Running experiments:  90%|████████▉ | 449/500 [05:00<00:35,  1.43it/s]Running experiments:  90%|█████████ | 450/500 [05:01<00:31,  1.61it/s]Running experiments:  90%|█████████ | 451/500 [05:01<00:27,  1.77it/s]Running experiments:  90%|█████████ | 452/500 [05:04<00:54,  1.14s/it]Running experiments:  91%|█████████ | 453/500 [05:04<00:44,  1.05it/s]Running experiments:  91%|█████████ | 454/500 [05:05<00:36,  1.25it/s]Running experiments:  91%|█████████ | 455/500 [05:05<00:31,  1.43it/s]Running experiments:  91%|█████████ | 456/500 [05:06<00:27,  1.60it/s]Running experiments:  91%|█████████▁| 457/500 [05:08<00:53,  1.25s/it]Running experiments:  92%|█████████▁| 458/500 [05:09<00:43,  1.04s/it]Running experiments:  92%|█████████▁| 459/500 [05:09<00:35,  1.17it/s]Running experiments:  92%|█████████▁| 460/500 [05:10<00:29,  1.37it/s]Running experiments:  92%|█████████▁| 461/500 [05:10<00:24,  1.57it/s]Running experiments:  92%|█████████▁| 462/500 [05:10<00:18,  2.05it/s]Running experiments:  93%|█████████▎| 463/500 [05:11<00:15,  2.44it/s]Running experiments:  93%|█████████▎| 464/500 [05:13<00:39,  1.09s/it]Running experiments:  93%|█████████▎| 465/500 [05:13<00:28,  1.24it/s]Running experiments:  93%|█████████▎| 466/500 [05:14<00:23,  1.46it/s]Running experiments:  93%|█████████▎| 467/500 [05:14<00:19,  1.65it/s]Running experiments:  94%|█████████▎| 468/500 [05:14<00:15,  2.13it/s]Running experiments:  94%|█████████▁| 469/500 [05:15<00:14,  2.21it/s]Running experiments:  94%|█████████▁| 470/500 [05:17<00:32,  1.09s/it]Running experiments:  94%|█████████▁| 471/500 [05:18<00:23,  1.21it/s]Running experiments:  94%|█████████▁| 472/500 [05:18<00:19,  1.42it/s]Running experiments:  95%|█████████▁| 473/500 [05:18<00:16,  1.62it/s]Running experiments:  95%|█████████▁| 474/500 [05:19<00:14,  1.76it/s]Running experiments:  95%|█████████▌| 475/500 [05:19<00:13,  1.91it/s]Running experiments:  95%|█████████▌| 476/500 [05:22<00:26,  1.12s/it]Running experiments:  95%|█████████▌| 477/500 [05:22<00:19,  1.17it/s]Running experiments:  96%|█████████▌| 478/500 [05:23<00:16,  1.32it/s]Running experiments:  96%|█████████▌| 479/500 [05:23<00:13,  1.53it/s]Running experiments:  96%|█████████▌| 480/500 [05:23<00:11,  1.71it/s]Running experiments:  96%|█████████▌| 481/500 [05:24<00:08,  2.15it/s]Running experiments:  97%|█████████▋| 483/500 [05:26<00:15,  1.13it/s]Running experiments:  97%|█████████▋| 484/500 [05:27<00:12,  1.29it/s]Running experiments:  97%|█████████▋| 485/500 [05:27<00:10,  1.47it/s]Running experiments:  97%|█████████▋| 486/500 [05:28<00:08,  1.64it/s]Running experiments:  97%|█████████▋| 487/500 [05:28<00:07,  1.81it/s]Running experiments:  98%|█████████▊| 488/500 [05:28<00:06,  1.96it/s]Running experiments:  98%|█████████▊| 489/500 [05:31<00:11,  1.07s/it]Running experiments:  98%|█████████▊| 490/500 [05:31<00:08,  1.23it/s]Running experiments:  98%|█████████▊| 491/500 [05:31<00:06,  1.41it/s]Running experiments:  98%|█████████▊| 492/500 [05:32<00:05,  1.60it/s]Running experiments:  99%|█████████▊| 493/500 [05:32<00:03,  2.02it/s]Running experiments:  99%|█████████▉| 494/500 [05:32<00:02,  2.47it/s]Running experiments:  99%|█████████▉| 495/500 [05:33<00:02,  2.44it/s]Running experiments:  99%|█████████▉| 496/500 [05:33<00:01,  2.17it/s]Running experiments:  99%|█████████▉| 497/500 [05:36<00:03,  1.06s/it]Running experiments: 100%|█████████▉| 498/500 [05:36<00:01,  1.14it/s]Running experiments: 100%|█████████▉| 499/500 [05:37<00:00,  1.36it/s]Running experiments: 100%|██████████| 500/500 [05:37<00:00,  1.56it/s]Running experiments: 100%|██████████| 500/500 [05:37<00:00,  1.48it/s]

📊 Layer 25, Clamping 0.0x
  Recent: A=60.0%, B=20.0%, C=20.0%, Avg risk=0.60
  Recent: A=47.1%, B=35.3%, C=17.6%, Avg risk=0.71
  Recent: A=47.8%, B=34.8%, C=17.4%, Avg risk=0.70
  Recent: A=46.9%, B=28.1%, C=25.0%, Avg risk=0.78
  Recent: A=45.2%, B=26.2%, C=28.6%, Avg risk=0.83

📊 Layer 25, Clamping 0.5x
  Recent: A=75.0%, B=0.0%, C=25.0%, Avg risk=0.50
  Recent: A=70.0%, B=10.0%, C=20.0%, Avg risk=0.50
  Recent: A=61.5%, B=15.4%, C=23.1%, Avg risk=0.62
  Recent: A=62.5%, B=18.8%, C=18.8%, Avg risk=0.56
  Recent: A=63.2%, B=21.1%, C=15.8%, Avg risk=0.53

📊 Layer 25, Clamping 1.0x
  Recent: A=66.7%, B=0.0%, C=33.3%, Avg risk=0.67
  Recent: A=55.6%, B=33.3%, C=11.1%, Avg risk=0.56
  Recent: A=53.3%, B=26.7%, C=20.0%, Avg risk=0.67
  Recent: A=55.6%, B=27.8%, C=16.7%, Avg risk=0.61
  Recent: A=52.6%, B=26.3%, C=21.1%, Avg risk=0.68

📊 Layer 25, Clamping 2.0x
  Recent: A=50.0%, B=16.7%, C=33.3%, Avg risk=0.83
  Recent: A=57.1%, B=14.3%, C=28.6%, Avg risk=0.71
  Recent: A=66.7%, B=11.1%, C=22.2%, Avg risk=0.56
  Recent: A=53.3%, B=20.0%, C=26.7%, Avg risk=0.73
  Recent: A=55.6%, B=16.7%, C=27.8%, Avg risk=0.72

📊 Layer 25, Clamping 5.0x
  Recent: A=33.3%, B=0.0%, C=66.7%, Avg risk=1.33
  Recent: A=33.3%, B=0.0%, C=66.7%, Avg risk=1.33
  Recent: A=41.7%, B=8.3%, C=50.0%, Avg risk=1.08
  Recent: A=41.2%, B=11.8%, C=47.1%, Avg risk=1.06
  Recent: A=42.1%, B=10.5%, C=47.4%, Avg risk=1.05

📊 Layer 30, Clamping 0.0x
  Recent: A=0.0%, B=11.1%, C=88.9%, Avg risk=1.89
  Recent: A=12.5%, B=18.8%, C=68.8%, Avg risk=1.56
  Recent: A=19.0%, B=23.8%, C=57.1%, Avg risk=1.38
  Recent: A=18.5%, B=22.2%, C=59.3%, Avg risk=1.41
  Recent: A=15.6%, B=21.9%, C=62.5%, Avg risk=1.47

📊 Layer 30, Clamping 0.5x
  Recent: A=50.0%, B=0.0%, C=50.0%, Avg risk=1.00
  Recent: A=42.9%, B=0.0%, C=57.1%, Avg risk=1.14
  Recent: A=45.5%, B=0.0%, C=54.5%, Avg risk=1.09
  Recent: A=62.5%, B=0.0%, C=37.5%, Avg risk=0.75
  Recent: A=64.7%, B=0.0%, C=35.3%, Avg risk=0.71

📊 Layer 30, Clamping 1.0x
  Recent: A=40.0%, B=40.0%, C=20.0%, Avg risk=0.80
  Recent: A=28.6%, B=42.9%, C=28.6%, Avg risk=1.00
  Recent: A=33.3%, B=33.3%, C=33.3%, Avg risk=1.00
  Recent: A=42.9%, B=28.6%, C=28.6%, Avg risk=0.86
  Recent: A=52.9%, B=23.5%, C=23.5%, Avg risk=0.71

📊 Layer 30, Clamping 2.0x
  Recent: A=66.7%, B=0.0%, C=33.3%, Avg risk=0.67
  Recent: A=60.0%, B=0.0%, C=40.0%, Avg risk=0.80
  Recent: A=66.7%, B=0.0%, C=33.3%, Avg risk=0.67
  Recent: A=55.6%, B=11.1%, C=33.3%, Avg risk=0.78
  Recent: A=45.5%, B=18.2%, C=36.4%, Avg risk=0.91

📊 Layer 30, Clamping 5.0x
  Recent: A=0.0%, B=0.0%, C=100.0%, Avg risk=2.00
  Recent: A=33.3%, B=16.7%, C=50.0%, Avg risk=1.17
  Recent: A=30.0%, B=30.0%, C=40.0%, Avg risk=1.10
  Recent: A=38.5%, B=30.8%, C=30.8%, Avg risk=0.92
  Recent: A=57.9%, B=21.1%, C=21.1%, Avg risk=0.63

✅ Results saved to: /data/llm_addiction/results/exp3_all_features_20250813_231751.json

SUMMARY:

layer_25:
  0.0x: A=45.2%, B=26.2%, C=28.6%, Avg risk=0.83 (42/50 valid)
  0.5x: A=63.2%, B=21.1%, C=15.8%, Avg risk=0.53 (19/50 valid)
  1.0x: A=52.6%, B=26.3%, C=21.1%, Avg risk=0.68 (19/50 valid)
  2.0x: A=55.6%, B=16.7%, C=27.8%, Avg risk=0.72 (18/50 valid)
  5.0x: A=42.1%, B=10.5%, C=47.4%, Avg risk=1.05 (19/50 valid)

layer_30:
  0.0x: A=15.6%, B=21.9%, C=62.5%, Avg risk=1.47 (32/50 valid)
  0.5x: A=64.7%, B=0.0%, C=35.3%, Avg risk=0.71 (17/50 valid)
  1.0x: A=52.9%, B=23.5%, C=23.5%, Avg risk=0.71 (17/50 valid)
  2.0x: A=45.5%, B=18.2%, C=36.4%, Avg risk=0.91 (11/50 valid)
  5.0x: A=57.9%, B=21.1%, C=21.1%, Avg risk=0.63 (19/50 valid)

✅ ALL features reward choice experiment complete!
